{
  "schema_version": "1.0.0",
  "language": "rust",
  "schema_provenance": {
    "authority": "Safety-Critical Rust Consortium Coding Guidelines",
    "revision": "83978c4c8e947b0044dc5d182d298ab793ba14c4",
    "url": "https://github.com/Safety-Critical-Rust-Consortium/safety-critical-rust-coding-guidelines/tree/83978c4c8e947b0044dc5d182d298ab793ba14c4",
    "borrowed_concepts": ["stable identity", "category", "lifecycle maturity", "release applicability", "decidability", "scope", "rationale", "examples", "deviation"]
  },
  "modelled_profiles": ["ordinary", "strict", "high_assurance"],
  "production_profiles": ["strict"],
  "rules": [
    {
      "id": "RUST-READ-001",
      "title": "Keep control flow direct and proportionate",
      "category": "advisory",
      "maturity": "approved",
      "decidability": "partially_decidable",
      "dimensions": ["architecture", "human_quality"],
      "applicability": {
        "crate_kinds": ["all"],
        "triggers": ["new or materially changed functions, modules, or abstractions"],
        "rust_release": "repository MSRV and newer"
      },
      "enforcement_by_profile": {
        "ordinary": "advisory",
        "strict": "required",
        "high_assurance": "required"
      },
      "requirement": "Changed code must use the simplest control flow and abstraction shape that preserves the governing invariants. Every additional branch, layer, wrapper, generic, or indirection must carry a concrete responsibility.",
      "rationale": "Unnecessary machinery increases cognitive load, obscures invariants, and expands the change surface. Mechanical complexity signals are useful prompts but cannot decide architecture by threshold alone.",
      "provenance": [
        {
          "authority": "Microsoft Pragmatic Rust Guidelines",
          "maturity": "independent",
          "revision": "c1d2efc4692630d5d2143b4ca446790005a714c9",
          "url": "https://github.com/microsoft/rust-guidelines/tree/c1d2efc4692630d5d2143b4ca446790005a714c9",
          "upstream_rules": ["M-SIMPLE-ABSTRACTIONS", "M-AVOID-WRAPPERS", "M-BALANCED-MODULES"]
        },
        {
          "authority": "Clippy",
          "maturity": "official",
          "revision": "stable-docs-reviewed-2026-08-24",
          "url": "https://rust-lang.github.io/rust-clippy/stable/index.html#cognitive_complexity",
          "upstream_rules": ["clippy::complexity", "clippy::cognitive_complexity"]
        }
      ],
      "authoring_projection": [
        "State the invariant before adding a branch or abstraction.",
        "Prefer a direct implementation when an extra layer has no independent policy, boundary, substitution, or evidence role.",
        "Re-read the final diff for nested control flow and machinery that can be removed without hiding intent.",
        "At closeout, account for every changed line and public trait implementation against requested behavior, a governing invariant, or necessary diagnostics. Remove optional derives, convenience surface, formatting-only churn, and boilerplate that the task or repository contract does not require."
      ],
      "audit_procedure": [
        "Inspect changed functions and their direct call paths, not isolated line counts.",
        "Name the responsibility of each new abstraction or report it as unjustified.",
        "Assess every abstraction candidate independently under this rule even when a detector or evaluation-only rule reports the same code. Record a RUST-READ-001 finding only when the abstraction lacks an independent responsibility or is disproportionate; a compliant assessment is not a finding.",
        "Use complexity lints as leads, then verify whether simplification preserves clearer invariants and error paths."
      ],
      "mechanical_enforcement": [
        {
          "tool": "clippy",
          "check": "clippy::complexity plus evaluation-only clippy::cognitive_complexity, clippy::too_many_lines, and clippy::type_complexity leads",
          "role": "candidate",
          "caveat": "Threshold lints cannot prove that an abstraction is justified or readable and grant no conformance or repair authority."
        }
      ],
      "remediation": {
        "default_authority_by_profile": {
          "ordinary": "review_required",
          "strict": "review_required",
          "high_assurance": "review_required"
        },
        "action_overrides": [],
        "guidance": "Flatten control flow or remove machinery only after checking callers, public contracts, and the responsibility the structure may encode."
      },
      "deviation": {
        "allowed": true,
        "required_evidence": ["named invariant or responsibility", "why the simpler shape is insufficient", "focused test or contract evidence when risk-bearing"]
      },
      "completion_evidence": ["final-diff human-quality review", "complexity evidence where configured", "recorded rationale for retained non-obvious structure"]
    },
    {
      "id": "RUST-API-001",
      "title": "Public types implement semantically appropriate common traits",
      "category": "required",
      "maturity": "approved",
      "decidability": "partially_decidable",
      "dimensions": ["architecture", "human_quality"],
      "applicability": {
        "crate_kinds": ["library", "application with public crate API"],
        "triggers": ["new or changed public type"],
        "rust_release": "repository MSRV and newer"
      },
      "enforcement_by_profile": {
        "ordinary": "required",
        "strict": "required",
        "high_assurance": "required"
      },
      "requirement": "Every public type must implement Debug unless doing so would expose protected data. Other common traits must be implemented only when their semantics are valid and useful for the type.",
      "rationale": "Downstream crates cannot add foreign standard-trait implementations. Missing appropriate traits harms debugging and interoperability, while indiscriminate derivation can create false semantics or leak secrets.",
      "provenance": [
        {
          "authority": "Rust API Guidelines",
          "maturity": "official",
          "revision": "live-docs-reviewed-2026-08-24",
          "url": "https://rust-lang.github.io/api-guidelines/interoperability.html#c-common-traits",
          "upstream_rules": ["C-COMMON-TRAITS", "C-DEBUG"]
        },
        {
          "authority": "Microsoft Pragmatic Rust Guidelines",
          "maturity": "independent",
          "revision": "c1d2efc4692630d5d2143b4ca446790005a714c9",
          "url": "https://github.com/microsoft/rust-guidelines/tree/c1d2efc4692630d5d2143b4ca446790005a714c9",
          "upstream_rules": ["M-PUBLIC-DEBUG", "M-PUBLIC-DISPLAY"]
        }
      ],
      "authoring_projection": [
        "For each new public type, decide Debug first and then consider Clone, equality, ordering, hashing, display, default, and conversions by semantics.",
        "Use a manual redacted Debug implementation when derived output would expose protected data."
      ],
      "audit_procedure": [
        "Inventory new and changed public types.",
        "Check Debug mechanically and review every other applicable common trait against the type's semantics and downstream use.",
        "Do not report or add an optional common trait merely because derivation is semantically possible; require concrete downstream use, an established repository convention, or a public contract that makes the trait useful.",
        "Reject derives whose equality, ordering, hashing, copying, or default value would be misleading."
      ],
      "mechanical_enforcement": [
        {
          "tool": "rustc",
          "check": "missing_debug_implementations",
          "role": "evidence",
          "caveat": "The lint does not decide redaction or which other traits are semantically correct."
        },
        {
          "tool": "rustdoc",
          "check": "rustdoc::broken_intra_doc_links and rustdoc::private_intra_doc_links",
          "role": "evidence",
          "caveat": "Link resolution is mechanical under a fixed rustdoc configuration; the intended API target remains a human decision."
        }
      ],
      "remediation": {
        "default_authority_by_profile": {
          "ordinary": "review_required",
          "strict": "review_required",
          "high_assurance": "review_required"
        },
        "action_overrides": [],
        "guidance": "Add only justified derives or manual implementations; treat public trait additions as API decisions."
      },
      "deviation": {
        "allowed": true,
        "required_evidence": ["why Debug is unsafe or inapplicable", "alternative diagnostic path", "review of other applicable common traits"]
      },
      "completion_evidence": ["public-type inventory", "trait-semantics review", "compiler or lint evidence for Debug coverage"]
    },
    {
      "id": "RUST-ERR-001",
      "title": "Represent recoverable failure explicitly",
      "category": "required",
      "maturity": "approved",
      "decidability": "partially_decidable",
      "dimensions": ["correctness_assurance", "architecture", "human_quality"],
      "applicability": {
        "crate_kinds": ["all"],
        "triggers": ["fallible operations, untrusted input, external boundaries, unwrap, expect, panic, indexing"],
        "rust_release": "repository MSRV and newer"
      },
      "enforcement_by_profile": {
        "ordinary": "required",
        "strict": "required",
        "high_assurance": "mandatory"
      },
      "requirement": "Recoverable failures must be represented with Result, Option, or a repository-defined equivalent. Panics and panic-capable convenience operations are reserved for proven programming errors or explicit termination policy, with the invariant made visible.",